번호,용어,설명
1,1인당 국민소득,"국민총소득은 한 나라의 국민이 나라 안에서는 물론 외국에서 일정기간동안에 벌어들인 소득액을 모두 합한 것이다. 그런데 국민총소득만  가지고는 우리나라 국민이 미국이나 중국 등 다른 나라 국민에 비해 얼마나 잘 사는지를 알 수 없다. 왜냐하면 국민총소득을 보면 나라 전체의 소득 수준은 알 수 있지만 국민의 평균적인 생활수준은 파악하기 어려운데 이는 국민총소득이 많더라도 인구가 많으면 한사람에게 돌아가는 소득이 적기 때문이다.

따라서 국민총소득을 인구수로 나눈 1인당 국민소득을 통하여 국민 한 사람이 평균 얼마의 소득을 벌고 있는가를 알 수 있으며 1인당 국민소득은 다른 나라와의 비교를 위해서 미국 달러화로 표시한다.."
2,CMA,"고객이 예치한 자금을 양도성예금증서, 국공채 등의 채권에 투자하여 그 수익을 고객에게 돌려주는 금융상품"
3,GDP디플레이터,명목GDP를 실질GDP로 나눈 값으로 나라 경제의 전반적인 물가수준을 의미한다.
4,IMF Debt Guide Final Draft 2001,"1990년대 이후 민간부문을 통한 국제자본 흐름의 급증 및 이를 반영한 국제수지통계 편제기준의 개편 등으로 기존 외채통계의 유용성이 크게 떨어짐에 따라 외채통계 편제에 관한 이전의 국제적 통일기준(Grey Book, 1988년)의 보완 필요성이 증대. 특히 1990년대중 수차례의 국제금융위기를 겪는 과정에서 포괄적이고 비교가능한 외채통계의 중요성에 대한 인식이 더욱 확산됨에 따라 국제통화기금(IMF) 등 8개 국제기구들은 새로운 외채통계 편제기준의 마련을 위한 공동작업을 추진하여, 2001년 11월 그동안의 여건변화를 반영한「외채통계 작성 및 이용 지침서」를 새로이 발표하였으며, 각 국은 동 지침에 따라 외채통계를 작성·발표하도록 권고.

   ㅇ 이 지침서는 이전의 통일기준에 도입되었던 많은 개념들을 확장하여 경제내 여러 부문과 각종 채무 형태에 일관되게 적용할 수 있는 분명한 기준을 제공. 아울러 국민계정 및 국제수지통계 편제에 관한 새로운 국제기준(1993 SNA 및 BPM5)과 포괄범위 분류방법 등을 최대한 일치시킴으로써 외채통계와 여타 거시경제통계간의 연계분석 및 국가간 비교분석에 있어 유용성이 제고되도록 함. 이외에도 외채통계 작성 및 활용과 관련된 여러가지 관점과 조언은 물론 국제기구들의 외채관련 활동을 소개함으로써 이용자들이 외채통계를 보다 깊이있게 이해할 수 있도록 하고 있음."
5,MMF,"투자신탁회사가 고객들의 자금을 모아 펀드를 구성하고 이를 기업어음(CP), 양도성예금증서(CD), 콜론 등 주로 단기금융상품에 투자하는 금융상품"
6,OECD 경기선행지수,"OECD에서 글로벌 및 개별 국가의 경기전환점을 조기에 파악하기 위해 작성·발표하는 지표로서 주택착공호수, 장단기금리차 등 경기에 선행하는 것으로 알려진 주요 실물·금융 지표들을 이용하여 개별 국가의 경기선행지수를 산출한 뒤 이를 바탕으로 글로벌, 권역 단위의 지수를 작성하여 발표 "
7,가격결정,"시장에서 수요자(소비자)는 물건을 될 수 있는 한 싸게 사고 공급자(생산자)는 가능한 한 물건을 비싸게 파는 것이 유리하다. 그러나 이러한 물건의 가격은 수요자나 공급자 어느 한쪽이 일방적으로 결정하는 것이 아니라 시장에서 그 물건의 수요와 공급의 양에 따라 결정된다.

즉, 어떤 물건이 인기가 좋아 이 물건을 사려는 사람은 많은데 팔겠다는 물건의 양이 적은 경우(수요량이 공급량보다 많은 경우)에는 가격이 올라가고 반대로 사겠다는 양보다 더 많은 물건이 시장에 공급되면 가격은 떨어지게 된다.

아이스크림을 예로 들어 설명해보자. 어떤 나라에서 나라 전체의 상점에 공급되는 아이스크림의 양은 변하지 않고 일정한 양이 공급되고 있는데 아이스크림을 사려는 사람(수요량)이 현재보다 늘어난다면 아이스크림의 가격은 현재보다 올라가게 된다.

이렇게 아이스크림의 가격이 많이 오르게 되면  아이스크림을 사려는 사람의 수가 줄어들게 되고 공급되는 아이스크림의 양은 상대적으로 늘어나게 되어 아이스크림의 가격을 통하여  아이스크림의 수요와 공급은 어떤 균형점을 갖게 된다.  이와같은 일련의 과정을 가격결정 메커니즘이라고 부르며
이렇듯 시장에서는 다수의 수요자와 공급자가 가격을 매개로 물건을 공급하고 구매(수요)하는 활동을 통하여 가격이 결정된다"
8,가계,경제활동의 결과 얻어진 대가를 수입원으로 하여 상품과 서비스의 최종적 소비활동을 영위하는 경제주체를 말한다. 가계는 경제분석에서 기업과 정부와 함께 경제활동을 영위하는 주체 중에서 중요한 부문을 구성한다. 구체적으로는 세대를 단위로 하며 세대는 생계를 같이하는 일단의 동거인을 총칭하는 개념이다. 국민계정(SNA)에서는 가계란 동일한 주거시설을 사용하고 소득과 부의 일부 또는 전부를 공유하며 특정 유형의 재화 및 서비스(주로 주거와 음식)를 집합적으로 소비하는 소규모 개인집단으로 정의된다.
9,가계 순저축률,가계 순저축액(총저축액-고정자본소모)을 가계의 순조정처분가능소득과 연금기금의 가계순지분 증감액을 더한 금액으로 나누어 계산한다.
10,가계소비지출,"가구에서 가구원의 생활에 필요한 재화나 용역을 구입한 대가로 지출되는 일체의 비용으로서 식료품비, 광열수도비, 교육비, 교양오락비, 주거비, 피복신발비, 교통통신비, 기타잡비로 구성되며 현금지출 외에 자가소비 평가액, 주거용 건물의 감가상각액도 포함된다.(가계조사에서는 주거용 건물의 감가상각액이 제외된다)"
11,가계수지,"일정기간 중 가구의 총수입과 총지출을 가계수지라고 하는데 언제나 「총수입 = 총지출」의 관계가 성립된다.

· 총 수 입 = 소득+기타수입+전월이월금
· 총 지 출 = 소비지출+비소비지출+기타지출+월말현금잔고
· 흑 자 = 소득-가계지출 = 소득-(소비지출+비소비지출) = 처분가능소득-소비지출
· 흑자율(%) = (흑자 ÷ 가처분소득) × 100"
12,가계에 봉사하는 비영리단체,"가계에 봉사하는 비영리단체(NPISH, Non-profit institutions serving households)란 가계에 재화나 서비스를 무상 또는 경제적으로 의미없는 가격으로 제공하는 비영리단체를 가리키며 종교단체, 정당, 노동조합, 소비자단체, 자선단체 등이 대표적인 예이다. "
13,가계총처분가능소득(PGDI),가계가 소비나 저축으로 처분할 수 있는 소득으로 고정자본소모를 합산하여 산출
14,가공무역,거주자가 소유하거나 해외에서 조달한 원재료를 해외에서 가공하여 완제품을 만든 후 이를 국내로 반입하지 않고 가공국 또는 제3국으로 수출하는 방식의 무역을 의미한다.
15,가구,"1인 또는 2인 이상이 모여서 취사, 취침 등 생계를 같이 하는 사회경제적 생활단위를 말한다. "
16,가구주,"호주 또는 세대주와는 관계없이 그 가구를 실질적으로 대표하는 사람을 말하며, 혈연관계가 없는 사람이 2인 이상 함께 사는 경우에는 그 중 연장자 또는 대표자를 선정하여 가구주로 한다.(인구주택총조사)
호주 또는 세대주와는 관계없이 해당가구의 구성원으로서 그 가구의 생계를 책임지고 있으며, 또한 사실상 생계유지를 위한 비용을 조달하는 사람을 가구주로 한다.(가계조사)"
17,가동률,"생산설비가 어느 정도 이용되는지를 나타내는 지표로서 사업체가 주어진 조건(설비, 노동, 생산효율 등)하에서 정상적으로 가동하였을 때 생산할 수 있는 최대 생산량(=생산능력)에 대한 실제 생산량의 비율(%)을 말한다."
18,가스수도비,"제조부문에서 발생한 수도료, 연료비 및 유류비 등을 말한다. 다만, 운송업종에 있어서 운송수익 창출에 직접 사용되는 연료비 및 유료비는 업종특성상 재료비로 계상된다."
19,"가중값, 가중치","어떤 대상이 속해있는 집단에서, 다른 대상에 비해 상대적인 중요성을 수치로 나타내는 값을 말한다. 종합지수를 계산할 때는 개별 구성항목의 지수를 단순산술평균하지 않고 각 항목의 중요도를 고려하여 가중평균하는데 이때 중요도로 가중값을 사용한다. 예컨대 물가지수의 경우에는 상품거래금액 또는 소비지출금액을, 산업생산지수의 경우에는 부가가치액을 가중값으로 하고 있다."
20,가중평균지수,하위 개별 구성지수에 상대적인 중요도나 영향도에 해당하는 각각의 가중값을 적용하여 계산한 평균값을 말한다. 생산지수나 물가지수 등 각종 경제통계에서는 단순산술평균지수 보다는 가중평균지수를 많이 이용한다.
21,간접세와 직접세,"직접세(直接稅)는 소득세, 법인세, 상속세 등과 같이 소득이나 부에 대하여 부과하는 세금으로 세금을 '부담하는 사람'과 '납부하는 사람'이 일치해 조세부담이 전가(轉嫁)되지 않는 세금이다

간접세(間接稅)는 세금을 납부할 의무가 있는 납세의무자와 세금을 최종적으로 부담할 담세자가 일치하지 않고 조세의 부담이 다른 사람에게 전가되는 세금을 말한다. 이 경우 납세의무자가 납세는 대납(代納)하되 그 조세가 물품가격 등을 통해 조세부담자에게 다시 전가되는 것이다. 간접세로는 부가가치세, 특별소비세, 주세, 전화세, 증권거래세, 인지세 등이 있다. "
22,감가상각률 ,"비상각자산 즉 토지, 건설중인 자산을 제외한 나머지 유·무형자산에 대하여 당기에 어느정도 감가상각비를 계상하였는가를 나타내는 비율로서 이 비율이 높으면 유·무형자산에 대한 재투자비용 회수가 빠름을 의미한다."
23,감가상각비,토지와 건설중인 자산 같은 특수한 자산을 제외한 대부분의 고정자산은 여러 가지 원인(감모와 새로운 발명품 등에 의한 경제적 가치의 감소)에 의하여 그 가치가 점차 감소되어 경영목적에 사용할 수 없게 되며 결국에 가서는 폐기하게 된다. 일정기간(내용년수) 일정비율로 추산하여 비용으로 간주하는 절차를 감가상각이라 하며 이상과 같이 자산의 이용으로 발생하는 비용을 감가상각비라 한다.
24,감응도계수,"모든 산업부문의 생산물에 대한 최종수요가 각각 한 단위씩 증가하였을 때 어떤 산업이 받는 영향, 즉 전방연쇄효과의 정도를 전산업 평균에 대한 상대적 크기로 나타낸 계수"
25,개발비 ,"특정 신제품 또는 신기술의 개발을 위한 내부 프로젝트는 연구단계와 개발단계로 구분하되 연구단계에서 발생한 모든 지출이나 개발단계에서 발생한 지출중 일정요건을 갖추지 못하는 경우에는 경상개발비·연구비 과목으로 해당기간의 비용으로 처리한다.
개발비가 무형자산으로 인식되기 위해서는 기술적 실현가능성, 개발후 완성자산을 사용하거나 판매하려는 기업의 의도나 능력, 미래 경제적 효익 창출력, 개발단계에서 발생한 지출의 객관적 측정가능성 등의 요건이 충족되어야 한다."
26,개발비상각 ,"무형자산으로서의 개발비에 대한 상각액을 말한다. 개발비란 신제품 또는 신기술개발과 관련하여 제품 및 용역의 생산을 위한 계획이나 설계에 대해 발생한 비용을 말하는데 이러한 개발비 중 무형자산인 개발비요건을 충족하지 못하는 경우 당기비용인 경상개발비로 처리하고, 요건을 충족하는 경우 무형자산인 개발비로 처리한다. 이에 대한 상각액이 개발비 상각이다."
27,개별 소비의 목적별 분류,"개별 소비의 목적별 분류(COICOP, Classification of Individual Consumption by Purpose)는 유엔 통계국에서 제정한 통계분류체계로, 가계의 소비지출을 실제 개별 소비 목적 별로 12개 부분으로 구분한다. 주요 항목으로는 식료품 및 비주류음료, 주류 및 담배, 의류 및 신발, 주거 및 수도광열, 보건, 교통 등이 있다."
28,개별가격지수,한 품목의 가격변화를 기준시점의 가격에 대한 비교시점 가격의 비율로 산출한 수치를 말한다. 일정한 시기를 기준(=100)으로 하여 개별상품의 시기에 따른 가격변동을 지수화한 것이다.
29,개별수량지수,한 품목의 수량변화를 기준시점의 수량에 대한 비교시점 수량의 비율로 산출한 수치를 말한다. 명목 금액의 변화에는 가격변동에 의하여 변화한 부분과 수량의 변화에 의하여 물리적으로 변화한 부분이 있는데 수량지수는 그 중 수량의 변화 부분을 나타낸다.
30,개인부문,"개인부문은 도시농어가 등의 가계와 개인기업 중 비법인기업으로 분류되지 않는 소규모 개인기업, 가계에 봉사하는 민간의 비영리기관을 포함한다. 민간의 비영리기관에는 민간의 조사 및 과학연구기관, 사립학교, 종교단체, 재단의 형태를 갖춘 병원, 직능단체, 소비자단체, 정당, 노동조합 등이 포함된다."
31,개인소득,"개인(가계 + 개인기업)에게 귀속되는 소득으로, 국민소득에서 법인세와 사내유보이윤을 제하고 정부 및 기업의 이전지출을 더하여 구한다.
· PI = NI(국민소득) - 법인세 - 사내유보이윤 + 정부 및 기업의 이전지출"
32,개인처분가능소득,"개인이 임의로 소비와 저축으로 처분할 수 있는 소득을 말한다.
· PDI = 개인소득(PI) - 개인소득세"
33,거래외증감표,"거래외증감표는 가격 또는 환율의 변동과 대손상각, 재평가 등 거래이외의 요인에 의해 발생하는 금융자산 및 부채잔액의 변동을 기록한 표이다. 증권시장에서 가격이 변동하는 주식?채권 등 유가증권, 대손상각이나 재평가 대상이 되는 금융기관의 예금?대출금 그리고 환율변동의 영향을 받는 외화관련 금융자산 등 거의 모든 금융자산이 거래 이외의 요인으로 변동한다. 이러한 거래외증감표는 금융자산 및 부채잔액의 변동액과 기간 중 실제 거래금액과의 차액으로 나타나며 금융거래표 및 금융자산부채잔액표와 동일한 부문분류기준에 의거 금융자산형태별로 작성된다."
34,거주성,주된 경제적 이익의 중심이 어디에 있는지에 따라 경제주체를 거주자와 비거주자로 구분하는 기준을 의미한다. 통상적으로 경제주체가 1년 이상 어떤 국가에서 경제활동 및 거래를 수행하거나 그러한 의도가 있을 경우 주된 경제적 이익의 중심이 그 국가에 있다고 본다.
35,거주자/비거주자,"국제수지표에서 거주자와 비거주자는 국적이 아닌 경제적 이익의 중심(center of predominant economic interest)을 기준으로 구분한다. 거주자는 주된 경제적 이익의 중심이 국민경제영역 내에 있는 경제주체를 의미한다. 국민경제영역 밖에 있는 여타 경제주체는 비거주자가 된다. 통상 경제주체가 어떤 나라에서 1년 이상 경제활동을 한 경우 이익의 중심이 그 국가에 있다고 본다. 외국인 이더라도 1년 이상 우리나라에서 생산활동에 참여하고 있으면 거주자로 보지만, 해외교포는 우리나라 국적이더라도 외국에서 경제활동을 수행하고 있으므로 비거주자로 분류한다. 
"
36,거처,사람이 살고 있는 모든 장소를 통칭하는 말로서 구조적으로 분리되고 독립된 하나의 거주단위를 말하며 주택과 주택이외의 거처로 구분된다.
37,건강평가,"응답자가 자신의 연령 수준을 감안하여 주관적으로 판단한 건강상태를 말하며, 주관적 건강상태 평가는 건강이 단순히 신체적으로 이상이 없는 상태를 의미하는 것이 아니라 정신적 및 사회적으로 안녕된 상태(Social Well-being State)라는 의미의 지표이다."
38,건물·구축물 ,"건물은 기업이 영업목적으로 토지에 건설한 건축물과 그것의 영속적 부속설비로서 건물과 냉난방, 전기, 통신 및 기타의 건물부속설비가 포함된다. 구축물은 토지에 부착된 토목설비 또는 공작물로서 교량, 안벽, 부교, 궤도, 저수지, 갱도, 굴뚝, 정원설비 등이 포함된다."
39,건설중인 자산 ,"건설중인 자산은 유형자산의 건설을 위해 재료비, 노무비 및 경비 등이 지출되었으나 건설이 완료되지 아니한 경우에 일시적으로 처리하기 위한 계정으로 건설이 완료되어 영업에 사용하게 된 때에는 해당 유형자산계정으로 대체 처리한다. 또한 건설자금으로 사용된 차입금에서 발생한 순금융비용은 건설중인 자산에 포함한다."
40,건축면적,"건축물 외벽의 중심선으로 둘러싸인 부분의 바닥면적으로 흔히 건평으로도 불리며, 일반적으로는 1층의 바닥면적을 건축면적이라고 한다. 넓은 의미로는 2층 이상도 포함한 바닥면적의 합계(연면적 또는 연건축면적)를 나타기도 한다."
41,건폐율,건축면적(대지에 둘 이상의 건축물이 있는 경우에는 이들 건축면적의 합계로 한다)의 대지면적에 대한 비율을 말한다. 건축밀도를 나타내는 지표의 하나로 시가지의 건축규제 및 토지이용 효과를 판정하는데 이용한다.
42,경기,"경기란 나라경제의 전체적인 활동수준을 의미한다. 사람의 기분이 좋을 때도 있고 나쁠 때도 있는 것처럼 또 우리 몸의 활동상태에 따라 체온이 오르내리듯이 나라경제도 활동상태에 따라 경기가 오르내리는 변화를 겪는다.

경제학자들이 경제의 움직임을 연구한 결과 마치 파도와 같이 호황기→ 후퇴기→ 불황기 → 회복기 → 호황기가 반복되면서 끊임없이 변동한다는 것을 발견하였으며 경기가 이렇게 일정한 움직임을 되풀이하는 것을 경기의 순환이라고 한다.
호황기는 생산, 소비 등 경제활동이 활발하게 전개되고 있는 상태이고 후퇴기는 서서히 위축되어가는 상태이다. 후퇴기 다음엔 경제가 침체상태에 빠지는 불황기가 오고 그러다 다시 조금씩 활기를 되찾는 회복기를 맞게 된다.

경기순환은 한 나라의 경제에서뿐만 아니라 세계경제 전체에서도 나타난다. 특히 요즘과 같은 세계화 시대엔 글로벌 경제 또는 지구촌 경제라고 해서 각 나라의 경제가 긴밀히 연결되어 있기 때문에 선진국들이 불황에 빠지면 다른 나라의 경기도 함께 침체되는 예가 많다.

경기는 국민생활에 광범위하게 영향을 미친다. 따라서 정부는 물론 기업 및 가계도 경기 동향과 전망을 정확하게 파악해야만 투자, 생산, 소비, 저축 등의 경제행위를 합리적으로 결정하고 향후 경기변동에 대비할 수 있다.

경기를 판단하기 위한 방법으로는 생산, 투자, 고용, 수출 등 경제 각 부문의 동향을 잘 반영한다고 판단되는 여러가지 숫자(경제지표)들이 어떻게 움직이고 있는가를 분석하는 방법, 종합경기지표라는 숫자로 판단하는 방법, 기업가나 소비자들이 경기를 어떻게 판단하고 있는지, 어떻게 전망하고 있는지에 대한 설문조사에 의한 방법 등이 있다.
이러한 자료를 통하여 현재의 경기국면이 어디에 위치하고 있는가,  이후의 경기는 어떠할 것인가를 미리 예상하는 경기예측을 하게 된다."
43,경기조절정책,"국가경제의 상태 또는 상황을 “경기”라는 말로 표현하는데 경기는 사람의 건강상태를 나타내주는 체온과 유사하다. 마치 사람의 체온이 건강상태에 따라 때로는 정상수준보다 높거나 낮을 수 있는 것처럼 경기도 경제상태에 따라 때로는 정상수준보다 과열되거나 냉각될 수 있다. 사람의 체온이 높거나 낮으면 건강을 회복하기 위해 적절한 치료를 받게 되는 것처럼 경기도 과열되거나 냉각되면 경제의 정상수준을 회복하기 위해 정책당국이 이에 맞는 정책을 취하게 되는데 이를 “경기조절정책”이라고 한다.

정책당국은 경기조절정책을 실행하기 위해 정부의 재정권한(지출 및 조세)을 이용하거나 또는 중앙은행의 통화제도 운용 권한(통화량 및 금리)을 이용하게 된다. 경기가 냉각될 때(경기불황)는 정부지출을 늘리거나 조세를 줄이는 재정정책 및 통화량을 늘리거나 금리를 내리는 통화정책이 활용*되며 반대로 경기가 지나치게 과열될 때는 정부지출을 줄이거나 조세를 늘리는 재정정책 또는 통화량을 줄이거나 금리를 올리는 통화정책이 활용된다. 결국 경기조절정책은 재정 또는 통화정책을 이용하여 국가경제 전체의 재화 또는 서비스에 대한 수요를 조절하는 데 목적을 두고 있다.

 * 정부가 재정지출을 늘리거나 조세를 줄이면 직접적으로 국민들의 소득이 높아져서 재화 및 서비스에 대한 수요가 증가하게 된다. 또한 중앙은행이 통화량을 늘리거나 정책금리를 내리면 기업들이 돈을 빌리면서 지불해야 하는 이자율이 낮아져 기업투자가 늘고 일자리도 증가하면서 재화 및 서비스에 대한 수요도 증가하게 된다.


한편 이러한 경기조절정책의 유효성에 대해 부정적인 견해도 있다. 이러한 견해의 근거는 여러 가지가 있는데 이들 근거의 공통점은 국가경제는 사람들간의 상호작용에 기인한 것이므로 기계처럼 인위적으로 정확하게 조작될 수 있는 것이 아니라는 점을 지적하고 있다. 예를 들어 경기불황기에 정부가 재정지출을 늘려 경기를 활성화시키려고 하는 경우를 생각해보자. 정부의 재정지출 확대로 재정이 적자를 나타내면 결국에는 국민들에게 세금을 걷어 재정적자를 충당해야 한다. 만약 이러한 사실을 대부분의 사람들이 예상할 수 있게 되면 정부의 재정지출로 소득이 늘어난 사람들은 이 증가된 소득을 나중에 내야할 세금을 마련하기 위해 소비하지 않고 모아둘 것이다. 결국 재정지출 증가에도 불구하고 사람들의 소비가 증가하지 않아 경기조절정책은 아무런 효과도 내지 못하게 된다. 이와 같이 사람들간의 행동을 정확하게 예측하는 것은 어려운 일이므로 인위적인 경기조절정책은 바람직하지 않다는 것이다"
44,경기종합지수,"국민경제 전체의 경기동향을 쉽게 파악하기 위하여 경제부문별(생산, 투자, 고용, 소비 등)로 경기에 민감하게 반영하는 주요 경제지표들을 선정한 후 이 지표들의 전월대비 증감률을 합성하여 작성하는데, 개별 구성지표들의 증감률 크기에 의해 경기변동의 진폭까지도 알 수 있으므로 경기변동의 방향, 국면 및 전환점은 물론 속도까지도 동시에 분석할 수 있어 우리나라의 대표적인 종합경기지표로 널리 활용되고 있다. 경기종합지수에는 선행(Leading), 동행(Coincident), 후행(Lagging)종합지수가 있다. 선행종합지수는 앞으로의 경기동향을 예측하는 지표로서 구인구직비율, 기계수주액(국내), 건설수주액, 총유동성 등과 같이 앞으로 일어날 경제현상을 미리 알려주는 10개 지표들의 움직임을 종합하여 작성한다. 동행종합지수는 현재의 경기상태를 나타내는 지표로서 산업생산지수, 제조업가동률지수, 도소매판매액지수, 비농가취업자수 등과 같이 국민경제 전체의 경기변동과 거의 동일한 방향으로 움직이는 8개 지표로 구성된다. 후행종합지수는 경기의 변동을 사후에 확인하는 지표로서 생산자제품재고지수, 회사채유통수익률, 가계소비지출 등과 같은 6개 지표로 구성된다."
