번호,용어,설명
377,사회조사,"넓은 의미에서의 사회조사는 모든 사회환경을 조사의 대상으로 한다. 그러나 표본조사를 전제로 하는 경우에는 사회를 구성하고 있는 사람들의 다양한 사회행동의 실태를 조사하는 것이다. 따라서 사회조사에서 중요한 것은, 1.조사대상의 범위와 특성, 2. 주제를 명확히 하는 것이다."
378,사회조사분석사,"지식기반 확충과 서비스분야의 고용확대 등 산업환경변화에 대응하기 위하여 99년에 신설된 「사회조사분석사」 국가기술자격을 취득한 자를 말한다. 자격의 종류는 검정기준의 난이도에 따라 1급과 2급으로 구분되며, 검정주관기관은 통계청이다.
1급의 검정기준은 「1.종합적인 조사계획을 수립할 수 있는 능력의 유무, 2.표본을 추출하는 방식을 결정할 수 있는 능력의 유무, 3.조사목적에 적합한 조사방법을 선택·결정할 수 있는 능력의 유무, 4.새로운 조사방법·표본추출법·통계기법 등을 활용할 수 있는 능력의 유무, 5.조사보고서 작성 업무를 총괄적으로 기획하고 관리할 수 있는 능력의 유무」 등이며,
2급은 「1.질문지(조사표)를 체계적으로 작성할 수 있는 능력의 유무, 2.조사방법에 관한 기본지식을 갖추고 있는 능력의 유무, 3.회수된 조사표를 검토하고 분석을 위한 자료 준비(편집, 부호화, 자료선정 등)를 수행할 수 있는 능력의 유무, 4.통계프로그램을 활용하여 조사결과를 분석할 수 있는 능력의 유무, 5.분석결과를 토대로 조사보고서를 작성할 수 있는 능력의 유무 」등이다."
379,산술평균,"대표값이란 어떤 통계자료의 전체적인 특성을 한마디로 표시해주는 지표라고 할 수 있는데 대표값으로는 평균,중앙값 및 최빈수 등이 있다. 이중에서 가장 널리 이용되는 대표값은 평균이며, 산출방식에 따라 산술평균,기하평균,조화평균으로 구분된다. 산술평균에는 단순산술평균과 가중산술평균이 있는데 단순산술평균은 가장 일반적으로 사용되는 평균으로서 모든 자료의 합을 자료의 총수로 나눈 것을 말한다. "
380,산업분류,"생산주체들이 수행하는 각종 상품과 서비스의 생산활동을 일정한 분류기준과 원칙을 적용하여 체계적으로 분류한 것이다. 통계청에서는 유엔의 국제표준산업분류에 기초하여 국내의 산업구조 및 기술변화를 반영한 한국표준산업분류를 제정·고시하고 있으며, 최근 고시된 제 8차 개정분 한국표준산업분류는 제 3차 개정분 국제표준산업분류에 기초하여 작성되었다."
381,산업생산지수,"국내 생산활동의 단기 추이를 파악하기 위하여 광업, 제조업, 전기 및 가스업을 대상으로 매월 생산을 조사(통계청의 광공업동태조사)하여 작성하는 통계이다. 우리 나라의 산업생산지수는 기준시 고정산술평균(Laspeyres) 산식을 이용하여 작성되며, 지수작성에 적용되는 기준물량 및 가중치는 5년마다 개편된다. 현재는 2000년 기준 광업·제조업통계조사 결과를 모집단으로 한 2000년 기준 지수를 작성하고 있으며, 실물경제동향분석, 국민총생산추계, 노동생산성측정 등에 이용된다"
382,산업연관표,국민소득계정이 재화와 서비스의 생산으로부터 발생한 소득(부가가치)과 최종수요를 파악하려는 것임에 비해 산업연관표는 생산과정에서 원재료 등으로 중간소비된 것까지도 포함된 모든 재화와 서비스의 생산과 그 처분을 경제활동별로 파악할 수 있도록 작성된 행렬형태의 표
383,산업재해,"산업안전보건법 제2조 1항에서 정의한 산업재해란 근로자가 업무에 관계되는 건설물, 설비, 원재료, 가스, 증기, 분진 등에 의하거나, 작업에 관련된 기타 업무에 기인하여 사망 또는 부상당하거나 질병에 이환되는 것을 말한다. 여기서의 산업재해는 업무에 관계되는 일로 사망자가 발생한 경우나 4일 이상의 요양을 요하는 부상을 입은 자가 발생한 경우와 업무와 관계되는 일로 질병이 발생한 경우를 말한다"
384,산출물,"한 산업 부문에서 원자재, 노동력 따위의 생산 요소를 투입하여 만들어 낸 재화나 서비스, 또는 그런 총량"
385,산출물분류,"경제활동 과정에서 생산될 수 있는 모든 산출물(이동재, 비이동재 및 서비스)을 분류한 것인데, 여기에는 토지 등과 같은 비생산 자산과 특허, 허가, 상표 및 복제권 등 무형자산도 포함되어 있다. 적용된 분류기준으로는 산출물의 성질과 산업원천(경제활동)이라는 두 가지 측면이 고려되었으며, 산출물의 성질로는 재화의 원재료, 생산(조립)단계, 재화의 생산방법 또는 투여된 서비스, 산출물의 생산목적, 용도, 기능 및 판매대상(수요자) 등이 고려되었다"
386,산포,"관측값의 퍼짐을 뜻한다. 관측값들이 평균을 중심으로 얼마나 집중되어 있는가 또는 얼마나 퍼져있는가를 알고자 하는 경우가 있다. 이러한 목적을 위한 산포의 측도는 여러 가지가 있는데, 예를 들면 범위(Range), 4분위편차(Quartile de viation), 평균편차, 표준편차, 지니평균차(Gini s mean difference)등이 있다."
387,상(제)품회전율 ,"일정기간(보통1년) 상품의 재고가 몇 회전 하였는가를 표시하는 비율로 자금의 회전속도, 즉 상품이 일정기간 동안 몇 번 당좌자산으로 전환하였는가를 나타내며, 상품 투하자본의 활동상황 및 상품관리를 위한 기초 활동성지표이다. 기업의 연간 상품매출액 또는 매출원가를 상품 평균재고로 나눈 것으로, 이 비율이 높을수록 상품의 판매 및 그 보충의 속도가 빠르다."
388,상관계수,"두 변수간의 상호 종속관계를 측정해주는 계수로써 -1에서 1까지의 값을 갖는다. 값이 0이면 상관이 없는 경우이다. 상관계수의 종류로서 Kendall, Spearman, pearson등이 제안한 여러 가지가 있다."
389,상세자금순환표,"자금순환표에서 거래상대부문에 대한 정보를 추가하여 금융상품별 경제부문 간 채권-채무관계, 즉 상호연계성을 보여주는 통계표"
390,상세채권통계,"자금순환표 내의 채권에 대한 발행 및 보유 내역, 이와 관련된 채권채무관계 등을 나타내는 통계로 채권발행표, 채권보유표와 채권발행보유관계표로 구성"
391,상수도보급률,"상수도보급률은 총인구에 대한 급수인구의 백분율을 말하며 주민등록상 인구를 기준으로 한다. 급수인구는 간이상수도, 우물물, 기타를 제외한 상수도 사용인구를 말한다. 급수인구, 시설용량, 급수량, 1일 1인당 급수량, 급수 도시수 등을 통하여 수자원 이용 실태를 알 수 있다"
392,상용종사자,"사업체에 상근 고용된 자로 고용주와 1년 이상의 고용 계약을 맺거나, 기간을 정하지 않고 고용된 자로 일반적으로 정규직원이라고 일컬어지는 자를 말한다."
393,상주인구,조사기준시점으로 현재 조사지역 내에 거주하거나 앞으로 거주예정인 모든 사람을 그 지역에 귀속시켜 계상한 인구이다.
394,"상품, 제품 및 반제품 ","상품이란 판매를 목적으로 구입한 상품, 미착상품, 적송품 등을 말하며 부동산 매매업의 경우 판매를 목적으로 소유하는 토지, 건물, 기타 이와 유사한 부동산은 이를 상품에 포함시킨다.
제품은 판매를 목적으로 제조한 생산품, 부산물 및 작업폐물 등으로 한다. 반제품은 이미 상당한 가공을 끝내고 저장중에 있는 중간제품과 부분품으로 그 자체가 판매 또는 저장가능 상태에 있다는 점에서 재공품과 구별된다"
395,상품수지,"가계는 수입과 지출을 기록하는 가계부를 작성함으로써 가계의 재정상태를 파악하는 데 도움을 받는다. 그런데 가계부 작성을 위한 수입 또는 지출을 발생원천 별로 구분해 보면 실물부문과 금융부문으로 나눌 수 있다. 실물부문은 근로소득, 재화 및 서비스의 구입과 판매 등과 관련된 수입과 지출을 말하며 금융부문은 저축, 대출 등과 관련된 수입과 지출을 말한다.

가계와 마찬가지로 국가도 외국과의 거래에서 발생하는 수입과 지출을 기록함으로써 경제상태를 파악하는 데 도움을 받을 수 있다. 또한 국가의 수입과 지출도 가계의 수입과 지출처럼 실물부문과 금융부문으로 구분할 수 있다. 재화 및 서비스의 이동, 임금 및 투자 소득의 이동 등과 관련된 수입과 지출은 실물부문에 해당되며 국가간의 자금거래 등과 관련된 수입과 지출은 금융부문에 해당한다.

여기서 한 국가가 실물부문에서 외국과 실행한 거래결과 벌어들인 수입에서 지출을 차감한 금액을 해당 국가의 경상수지라고 표현한다. 특히 거래결과 해당국가의 경상수지가 플러스를 보일 경우에는 “경상수지 흑자”라고 하고 경상수지가 마이너스일 경우에는 “경상수지 적자”라고 한다.

한편 경상수지는 다시 상품수지, 서비스수지, 본원소득수지, 이전소득수지로 구분되며 각각의 내용은 다음과 같다. 상품수지는 재화의 수출ㆍ입 거래결과를 나타내며, 서비스수지는 서비스의 수출ㆍ입 거래결과를 나타낸다. 본원소득수지는 생산요소(노동, 자본)의 이용대가인 임금, 이자, 배당 등의 유출ㆍ입 결과를 보여준다. 이전소득수지는 무상원조나 개인송금처럼 아무런 대가없이 자금이 이동하는 거래의 결과를 기록한다."
396,생계비,"인간이 생활하는 데 필요로 하는 비용으로서 가계비 중 소비지출에 대응하는 개념이다. 생계비에는 실제 조사결과로 나타난 지출 비용을 나타내는 실질생계비와 일정한 생활조건, 즉 거주지역·연령·가족구성 등에 대응하는 표준적인 소비유형을 가정하여 계산하는 표준생계비가 있다. 전자는「있는 그대로」의 생계비이나 후자는「있어야 할」생계비로서의 요소를 포함하고 있어 임금수준(특히 최저임금제)이나 최저생활비수준을 결정하는데 이용된다. 그런데 이 경우의 표준은 실태를 전제로 하여 가정되는 것이므로 양자는 밀접한 관계를 가진다. 생계비는 이론생계비(표준생계비, 최저생계비)와 실태생계비로 나누어 볼 수 있는데 가계조사 결과의 가구당 평균가계소비지출비는 실태생계비이다"
397,생계비지수,"두 개의 서로 다른 가격집단(품목집단)간에 동일한 만족(효용)을 얻기 위해 요구되는 최소비용을 비교하기 위해 작성되는 지수로서, 흔히 두 시점간에 동일한 만족을 얻기 위해 요구되는 최소비용을 비교하기 위해 작성된다"
398,생명표,"생명표란 한 출생집단이 연령이 많아짐에 따라 소멸되어 가는 과정을 나타내는 표이다. 어떤 연령층의 인구가 주어진 사망력의 유형과 수준이 그대로 적용된다는 가정 하에 평균적으로 더 살 수 있는 기간, 연령별 사망확률, 특정 연령의 사람이 다른 연령까지 생존할 수 있는 확률 등을 나타내 준다. 사망원인 생명표(Cause-deleted life-table)는 특정 사인을 완전히 제거했을 때의 생명표로, 주어진 특정 사인을 예방하거나 그 질병을 퇴치함으로써 그 사인이 완전히 제거되었다고 가정하고 나머지 사인에 의한 사망률 및 사망확률 등에 의하여 작성한다. 각 세별로 작성한 생명표는 완전생명표(Complete Life-Table), 5세 계급별로 작성한 생명표는 간이생명표(Abridged Life-Table)라 한다."
399,생산계정,"생산계정은 재화 및 서비스를 생산하는 활동을 기록하는 계정으로 균형항목은 총부가가치임. 총부가가치는 산출액에서 중간소비를 차감한 금액으로 정의되며 이는 개별 생산자, 산업 또는 부문이 GDP에 기여한 금액을 의미함. 총부가가치는 본원소득의 발생원천이 되며 따라서 제1차 소득분배계정으로 이월됨."
400,생산구조,"생산구조는 경상가격 국내총생산(GDP)에 대한 각 경제활동의 구성비로서 파악할 수 있는데, 이는 각 경제활동별 부가가치가 국내총생산(GDP)에 대해 얼마나 기여했는가를 파악할 수 있는 지표이다. 경제의 공업화정도라든가 산업구조의 고도화라고 하는 것은 이와 같은 산업별 구성비 추이를 보고 알 수 있다"
401,생산능력,"생산능력은 생산설비를 이용하여 생산 가능한 생산량을 말하며 생산능력은 생산 조건에 따라 최대생산능력과 적정생산능력으로 구분한다. 최대생산능력은 기술적으로 가능한 최대의 생산 수준이며 적정생산능력은 경제성을 고려한 최대의 생산수준으로, 통계청에서는 적정생산능력을 사용하고 있다."
402,생산물 보조금,생산물 보조금이란 재화·서비스의 물량단위당 일정 화폐금액 또는 단위당 가격의 일정비율만큼 생산된 재화 또는 서비스 한 단위에 대해 지급하는 보조금임
403,생산물세,"생산물세는 생산자가 재화 및 서비스를 생산, 배달, 판매, 이전 또는 기타 용도로 사용하였을 때 동 재화 및 서비스에 대해 부과되는 조세임.? 여기에는 재화의 수입이나 비거주자의 거주자에 대한 서비스 공급 등에 부과되는 수입세 및 관세가 포함됨"
404,생산성 지표,"· 1일 평균매출액 = 총매출액 ÷ 영업일수
  · 1일 1평당 매출액 = 1일 평균매출액 ÷ 매장면적
  · 1일 종업원 1인당 매출액 = 1일 평균매출액 ÷ 종업원수
  · 고객 1인 1회 구매액 = 1일 평균매출액 ÷ 1일 이용고객수"
405,생산성에 관한 지표 ,기업활동의 성과 및 효율을 측정하고 개별 생산요소의 기여도 및 성과배분의 합리성 여부를 규명하기 위한 지표이다. 그러므로 생산성에 관한 지표는 경영합리화의 척도라고 할 수 있으며 생산성 향상으로 얻은 성과에 대한 분배기준이 된다. 근래에는 기업경영의 성과를 부가가치 생산성이란 개념으로 측정하는 것이 일반적이다.
406,생산세,"생산세는 생산자가 재화 및 서비스를 생산, 배달, 판매, 이전 또는 기타 용도로 사용하였을 때 동 재화 및 서비스에 대해 부과되는 조세와 기타 생산에 사용된 토지, 건물, 기타 자산의 소유 또는 이용에 대한 조세와 고용된 노동력 또는 피용자보수에 대한 조세임"
407,생산액,"생산액은 판매(출하), 재고 증감 및 상품과 서비스의 전매(재판매) 등을 기초로 하여 계산된 것으로 사업체가 실제 생산한 금액으로 측정된다. 광공업통계조사의 생산액은 제품출하액(부산물·폐품, 임가공(수탁제조) 및 수리수입액 포함)에서 연간재고액(완제품, 반제품, 재공품 포함)의 증감액을 가감하여 계산된다
· 생산액 = 총매출액(출하액) +/- 완제품과 재공품의 재고 증감 +/- 전매를 위해 구입된 상품과 서비스의 재고 증감 - 전매를 위한 상품과 서비스의 구입 +자본화된 생산(자가 소비 및 투자)"
408,생산요소,"상품 및 서비스의 생산에 필요한 요소를 의미한다. 18세기 이전에는 토지와  노동만을 생산요소로 보았으나 산업화가 진행되면서 자본을 추가하여 일반적으로 토지, 노동, 자본을 전통적인 생산요소로 보고 있다. 여기서 토지는 단지 땅뿐만 아니라 모든 천연자원을 포괄하는 개념으로 사용된다. 그리고 최근에는 기업가 정신도 생산요소의 하나로 보는 견해도 있다.

각각의 생산요소는 상품 및 서비스의 생산과정에서 부가가치를 창출한다. 이 때 각 생산요소는 생산과정에서 기여한 만큼 토지에 대하여는 지대, 노동에 대하여는 임금, 자본에 대하여는 이자 등의 형태로 보수를 지급받게 된다.

예컨대 어떤 사람이 공장에서 매일 8시간씩 일하고 급료를 받는다면 이는 노동이라는 생산요소를 제공한 대가를 임금의 형태로 지급받는 것으로 이해할 수 있다."
409,생산유발계수,산업연관표에서 최종수요가 1단위 증가하였을 경우 이를 충족시키기 위하여 각 산업부문에서 직·간접으로 유발되는 생산액 수준을 나타내는 것
410,생산자가격,생산자가격은 생산된 재화 또는 서비스의 한 단위당 생산자가 구매자로부터 수취하는 금액에서 구매자에게 청구되는 부가가치세를 차감한 것임
411,생산자가격평가표,생산자가격평가표에서는 구매자가격평가표상의 각 거래액에 포함되어 있는 도소매마진과 화물운임을 떼어내어 각각 도소매 및 운수부문으로 이전처리한하는 경우 각 산업부문이 생산과정에서 부담한 모든 도소매마진과 화물운임은 각각 도소매부문과 운수부문으로부터 해당 서비스를 구입한 것으로 처리하는 셈이 되며 생산자가격평가표를 행으로 볼 때 도소매부문 및 운수부문에 기록되는 금액은 구매자가격평가표에 이미 나타나 있는 상품중개수수료 및 생산원가에 포함되는 운임에다가 각 부분의 거래액에서 이전되어 온 도소매마진 및 화물운임을 더한 것과 같게 됨
412,생산자물가지수,"국내생산자가 국내시장에 공급하는 상품 및 서비스의 가격변동을 측정하는 통계로서 경기동향 판단지표, GDP 디플레이터 등으로 이용된다. 지수작성에 이용되는 가격은 기초가격*(basic prices)을 원칙으로 하고 있다.

* 생산자가 실질적으로 수취하는 단위당 가격으로 생산자가격에서 담배소비세, 주세 등 기타생산물세를 차감하고 보조금을 합산한 가격"
413,생산자본스톡,총자본스톡에서 시간의 경과에 따른 자본재의 생산능력 효율 하락을 반영하여 평가한 것이다. 자산의 폐기액과 생산능력의 저하분을 모두 제외하여 계산한 것이기 때문에 실제 생산에 투입된 자본물량을 측정하는데 적합하다.
414,생산자산,"생산과정을 거쳐 만들어진 건물, 도로, 자동차, 기계류, 연구개발 등 고정자산과 재고품 등을 말한다. "
415,생산자제품재고지수,"광업, 제조업의 매월 말 제품재고 수준을 나타내는 통계이다. 생산자가 보유하고 있는 원재료, 반제품, 재공품과 유통업자의 재고품은 제외되며, 지수의 계산식, 계산방법, 작성 공표계열 등은 산업생산지수와 동일하다."
416,생산자출하지수,"광업, 제조업, 전기 및 가스업의 월간판매활동을 나타내는 지수로서, 지수의 계산식, 계산방법, 대표품목, 가중치체계, 작성 공표계열 등이 산업생산지수와 동일하다."
417,생활물가지수,"일상생활에서 소비자들이 자주 많이 구입하는 생활필수품을 대상으로 작성된 소비자물가지수의 보조지표로서, 품목은 쌀, 배추, 쇠고기 등 소비자들의 구입빈도가 많은 156개 생필품을 대상으로 하고 있어, 소비자의 구입빈도와 관계없이 516개 품목으로 작성되는 전체 소비자물가지수에 비해 소비자들이 체감하는 물가지수로 이용이 가능하다."
418,생활보호대상자,"국가에서 근로능력이 없는 자에 대하여 생계비 지원으로 최저생계보장 및 자립을 위한 지원으로 보호, 1인당 월소득 및 세대당 재산액을 조사하여 일정수준에 미치지 못할 경우 보호대상자로 선정한다. 생활보호대상자는 다시 거택보호대상자, 시설보호대상자, 그리고 자활보호대상자로 구분된다"
419,생활시간조사,"국민들의 생활양식을 구체적으로 파악하기 위해 하루 24시간 중 국민들이 어떠한 행동을 어느 시간대에 하고 있고, 특정 행동에 할당하는 시간량은 얼마인가를 조사하는 것이다. 이 조사는 통계청에서 1999. 9월 처음으로 전국 17,000가구의 10세 이상 가구원에 대해 조사한 이후 매 5년 주기로 실시하게 되며, 조사결과는 국민계정의 가계부문 생산의 가치측정에 대한 기초자료로 쓰일 뿐 아니라, 각종 노동, 복지, 문화, 교통관련 정책 수립이나 학문적 연구의 기초로 활용된다."
420,서버,"①일반적으로 서버라고 하면 다른 프로그램에게 서비스를 제공하는 컴퓨터 프로그램을 말한다.
  ②서버 프로그램이 실행되고 있는 컴퓨터 하드웨어도 서버라고 불린다(그 컴퓨터에서 여러 개의 서버나 클라이언트 프로그램이 동시에 운영되는 경우도 있다). 프린터 제어나 파일 관리 등 네트웍 전체를 감시, 제어하거나, 메인프레임이나 공중망을 통한 다른 네트웍과의 연결, 데이터, 프로그램, 파일 같은 소프트웨어 자원이나 모뎀, 팩스, 프린터 공유, 기타 장비 등 하드웨어 자원을 공유할 수 있도록 도와준다. 클라이언트의 수가 5~20대 정도인 소규모 LAN의 경우에는 1대의 서버로 충분히 모든 서비스를 소화할 수 있으나, 대규모 LAN의 경우에는 여러 대의 서버를 배치하고, 파일 관리는 파일서버, 프린터 제어는 프린터 서버, 인터넷 등의 외부와의 교환은 커뮤니케이션 서버가 담당하는 등 각각 역할을 세분하게 된다.
  ③클라이언트/서버 모델에서, 클라이언트 프로그램들로부터의 요구를 충족시키기 위해 기다리고 있는 프로그램을 말한다. 웹에 한정지어 생각하면, 웹 서버는 요청된 HTML 페이지나 파일들을 제공하는 컴퓨터 프로그램을 말한다. 웹 클라이언트는 사용자의 요구를 대신 서버에 요청하는 프로그램인데, 보통은 웹 브라우저가 웹 서버에게 HTML 파일을 요청하는 클라이언트 프로그램의 역할을 한다."
421,서비스,"SNA(국민계정)에 따르면 서비스는 소유권이 설정될 수 있는 독립된 실체가 아니며, 그 생산과 분리하여 거래될 수 없고, 소비자에게 제공되어야 생산이 완료된다. 서비스는 주문에 따라 생산되는 이질적인 산출물로서, 전형적으로 소비자의 수요에 따라 생산자의 활동으로 실현되는 소비단위의 제 여건 변화들로 이루어진다. 서비스의 생산은 다른 단위의 이익을 위해 한 단위가 수행한 활동으로 국한되어야 하며, 그렇지 않으면, 서비스산업은 발전할 수도 없고 시장도 형성될 수 없다. 서비스가 다른 단위에 의해 수행될 수 있는 활동의 형태라면 어떤 단위가 자가소비를 위한 서비스를 생산하는 것도 또한 가능하다. 서비스의 유형은 일반적으로 다음과 같다.
①소비재 조건의 변화 : 소비자가 보유하고 있는 상품의 수송, 청소, 수송 및 변형 등
②개인의 육체적 조건의 변화 : 운송, 숙박, 의료, 미용 등
③개인의 정신적 조건의 변화 : 교육, 정보, 상담, 오락 및 유사서비스
④제도단위의 경제적 상태의 변화 : 보험, 금융중개, 보증 등"
422,서비스수지,"외국과의 서비스거래로 수취한 돈과 지급한 돈의 차이를 말한다. 서비스수지는 가공서비스, 운송, 여행 등 12개의 항목으로 세분화되며, 각 항목에 해당하는 서비스거래를 통해 발생한 자금흐름을 기준으로 수입과 지급을 구분한다."
423,선박·차량운반구,"선박, 차량운반구는 기업소유의 선박 및 기타의 수상운반구와 철도차량, 자동차 및 기타의 육상운반구를 말한다."
424,설비투자효율 ,기업에서 실제로 사용되고 있는 설비자산(유형자산-건설중인 자산)이 어느 정도의 부가가치를 생산하였는가를 나타내는 지표로서 총자본투자효율의 보조지표로 이용된다. 또한 「설비투자효율×노동장비율 ＝ 종업원 1인당 부가가치」로 표시되므로 노동생산성의 변동요인분석에 중요한 지표로 이용된다.
425,성비,"인구의 성별 구조를 나타내는 지표로 여자 100명당 남자의 수를 나타낸다. 여아 출생아 100명당 남아 출생아수를 가리키는 출생성비, 여자사망률에 대한 남자사망률의 백분비인 사망률성비와 구분된다."
426,성장성에 관한 지표 ,"기업의 자산, 자본 등 경영규모와 기업활동의 성과가 당해년도중 전년에 비하여 얼마나 증가하였는가를 나타내는 지표로서 기업의 경쟁력이나 미래의 수익창출능력을 간접적으로 나타낸다."
