번호,용어,설명
639,자연증가,"인구의 자연증가는 출생건수에서 사망건수를 차감하여 구하며, 보통 1년 단위로 하여 계산된다.
· 자연증가 = 출생건수 - 사망건수"
640,자연환경,"자연환경은 대기, 물, 토양 등 무기환경과 동물, 식물 등의 생물로 구성되고 이들은 기능면에서 상호 끊임없이 물질순환을 이루어 조화와 균형을 유지해 가는데 이를 자연생태계라 한다. 자연생태계는 일단 파괴되면 복원이 거의 불가능하며, 복원이 된다 하더라도 오랜 시간이 소요되고 많은 경제적 부담이 따르기 때문에 사전에 그 대책을 수립하여 보전하는 것이 바람직하다. 자연 및 환경의 보전을 위한 토지이용계획 측면에서 살펴보면 다음과 같다.
자연공원은 자연자원과 유적·휴양자원 등 공원자원을 포함하고 있는 수려한 자연경관지를 원상태로 보존함과 동시에 합리적 이용을 도모함으로써 국민의 보건·휴양 및 정서생활의 향상을 기하고, 이를 후손에 영구히 계승시키기 위하여 지정한 일정구역으로서 국립공원, 도립공원, 군립공원으로 구분되어 있다.
도시공원은 도시계획구역 안에서 자연경관의 보호와 시민의 건강·휴양 및 정서생활의 향상에 기여하기 위하여 지정된 지역을 말한다. 그 기능에 따라 자연공원, 근린공원, 어린이공원, 묘지공원, 체육공원으로 세분한다.
녹지지역은 보건·위생·공해방지·보안과 도시의 무질서한 확산을 방지하기 위하여 도시계획으로 건설부장관이 도시계획구역 중 녹지의 보전이 필요한 일정구역을 획정·구분하여 지정한 지역을 말하는데 일반적으로 보전녹지, 생산녹지, 자연녹지로 구분한다."
641,자영자,무급가족종사자와 함께 전문적인 일을 독립적으로 수행 및 경영하는 자. 유급종업원 없이 자기 혼자 전문적인 일을 독립적으로 수행 및 경영하는 자를 말한다.
642,자유재,"자유재란 공급이 매우 풍부하여 특별한 노력을 하지 않고서도 자유롭게 향유할 수 있는 상품을 의미한다. 이는 돈이나 노력을 지불해야 얻을 수 있는 경제재(economic goods)의 반대 개념이다. 자유재는 대가를 치르지 않고서도 얼마든지 원하는 만큼 얻을 수 있기 때문에 경제문제를 일으키지 않음은 물론희소성의 원칙도 적용되지 않는다.

이러한 자유재는 현실세계에서는 매우 드문 것이 사실이다. 공기, 물, 햇빛 등이 전통적으로 자유재로 고려되어 왔다. 그러나 최근에는 양질의 생수를 높은 비용으로 구매하고, 맑은 공기를 마시기 위하여 휴양림을 찾아가는 등 기존에 자유재로 고려되던 재화들이 일부 경제재로 변하고 있는 것 또한 사실이다"
643,작물,"작물은 이용성과 경제성이 높아 사람의 재배대상이 되는 식물을 의미하는데 식량작물( 미곡, 맥류, 잡곡, 두류, 서류), 채소(과채류, 엽채류, 근채류, 조미채소, 기타채소, 시설채소), 과수, 특용작물(특용, 약용), 기타작물(전매작물, 묘상(논벼묘상, 기타곡류, 채소, 기타)), 기타(사료작물, 녹비작물, 화훼 등)로 분류된다. 작물생산량은 작물을 재배하여 수확한 일정기준(품질규격) 이상의 양을 말한다. 식량작물의 생산량 표시는 작물별로 적용되는 양곡환산표에 의해 정곡으로 표시하며, 서류의 생산량은 생서에 정곡환산율(감자 20%, 고구마 31%)을 적용하여 정곡으로도 표시한다. 시설고추는 풋고추 중량으로, 노지고추는 건고추 중량으로 표시한다."
644,잔폐물,"상품의 생산과정에서 발생하는 부산물의 일종으로서 최종생산물의 소비과정에서 발생하는 파지, 헌 병 등의 폐품과 한번 사용한 다음 추가가공을 거치고 재사용되는 고철 고합성수지용기 등 각 산업의 중간재로 투입은 되고 있으나 그것을 주산물로 생산하는 부문이 없는 생산물"
645,잠재GDP,한 나라가 단기적 호황 및 불황에 관계없이 완전고용수준의 노동력과 정상 가동상태의 자본이 투입되어 생산되는 GDP를 의미한다.
646,장기금융기관차입금,"대차대조표 상에서 고정부채에 포함되며 상환기일이 1년 이후에 도래하는 은행, 보험 및 기타 금융기관으로부터의 차입금을 말한다."
647,장기시장금리,"장기 자금 조달을 위한 장기금융시장(자본시장)에서 형성되는 1년 이상의 금리. 주요 금리로는 국고채, 회사채, 금융채 등이 있음"
648,장기자본수지,통화금융기관을 제외한 정부 및 민간부문의 1년 초과 대외자산 및 대외부채의 증감을 나타내며 장기부채 증감액에서 장기자산 증감액을 차감하여 산출한다
649,장기투자증권 ,"매도가능증권과 만기보유증권은 장기투자증권으로 분류하되 대차대조표일로부터 1년내 만기가 도래하거나 매도 등에 의하여 처분할 것이 거의 확실한 매도가능증권과, 대차대조표일로부터 1년내 만기가 도래하는 만기보유증권은 유동자산으로 분류한다. 한편 당행 기업경영분석 편제시 지분법적용투자주식은 장기투자증권에 포함된다."
650,장단기금리차,장단기금리차는 장기금리와 단기금리의 차이로 향후 글로벌 경제의 방향을 예측하는 데 많이 활용
651,장부가격/시장가격,장부가격은 원칙적으로 취득원가인데 반해 시장가격이라 함은 상품의 액면가치가 아닌 기준일자 현재 상품이 금융시장에서 거래되는 가격을 의미
652,장애인 의무고용 준수율,"종업원 300인 이상 총 사업체 중 장애인 의무고용제도를 준수하고 있는 사업체의 비율이다. 근로능력이 있는 장애인의 고용을 위한 장애인고용촉진법 등에 의거하여 종업원 300인 이상 사업체를 대상으로 근로자의 2% 이상을 장애인으로 고용하도록 하는 의무고용제도를 실시, 장애인 의무고용을 준수하지 못할 경우 부담금을 납부하도록 하고 있다"
653,장애인등록률,"전체 장애인 중 등록장애인이 차지하는 비율이다. 장애인 등록법에 모든 장애인은 등록하도록 규정되어 있으며, 등록장애인은 장애인 복지법과 국가유공자 예우에 관한 법률에 의거하여 등록한 장애인을 의미한다."
654,재고액,"조사기준일 현재 제조 및 판매를 목적으로 보유하고 있는 제(상)품총액으로 수송중인 미도착품과 제조 또는 판매를 위탁한 제(상)품 중 재고품 및 사업장 이외의 장소(영업장소, 하치장 등)에 보관중인 제(상)품도 포함되며, 생산 또는 구입가격 기준으로 계산한다."
655,재고자산 ,"재고자산은 기업이 정상적인 영업활동과정에서 판매를 위하여 보유하거나 생산과정에 있는 자산 및 생산 또는 서비스 제공과정에 투입될 원재료나 소모품의 형태로 존재하는 자산을 말한다. 여기에는 상품, 미착상품, 적송품, 제품, 반제품, 재공품, 원재료, 저장품 등과 선박·건설업의 미완성공사가 포함된다."
656,재고자산증가율 ,"(전기말 재고자산/당기말 재고자산)x100 - 100 , 기업이 판매 또는 제조를 목적으로 보유하는 상품, 제품, 원재료, 재공품 등의 재고자산이 당해연도에 얼마나 증가되었는가를 나타내는 지표이다"
657,재고자산회전율 ,"매출액을 재고자산으로 나눈 것으로서 재고자산의 회전속도 즉 재고자산이 당좌자산으로 변화하는 속도를 나타낸다. 일반적으로 이 비율이 높을수록 상품의 재고손실방지 및 보험료, 보관료의 절약 등 재고자산의 관리가 효율적으로 이루어지고 있음을 나타낸다. 그러나 재고를 정상적인 영업활동에 필요한 적정수준 이하로 유지하여 수요변동에 적절히 대처하지 못하는 경우에도 동 비율은 높게 나타나므로 해석에 유의하여야 한다."
658,재고증감,한 해 동안에 국내에서 생산되거나 오국에서 수입된 상품이 소비나 총고정자본형성 또는 수출로 처분되지 않고 창고에 쌓이는 부분을 말한다
659,재료비 ,"기초 재료 재고액 + 당기 재료 매입액 - 기말 재료 재고액, 제품을 만들기 위하여 소비된 물품의 가치로서, 제품제조에 직접 소비된 주요 재료비용(직접재료비)과 직접 소비되지 않은 보조 재료비, 소모품비등 간접재료비용이 이에 속한다"
660,재료비 대 매출액 ,"재료비는 제품의 제조에 직.간접적으로 투입된 재료의 비용으로서 기초재료 재고액과 당기재료 매입액의 합계액에서 기말재료 재고액을 차감하여 산출하며, 재료비 대 매출액은 매출액에서 재료비가 차지하는 비중을 나타내는 지표로서 원재료 이용의 효율성을 측정하는데 이용된다."
661,재료비 대 영업총비용 ,영업총비용은 제조비용+재료비+인건비+마케팅비+감가상각비용 등으로 구성되는데 이 중 재료비가 차지하는 비중을 나타내는 지표로서 재료비 대 매출액의 보조지표로 이용된다. 
662,재산소득,재산소득이란 금융자산 또는 유형 비생산자산(주로 토지 및 지하자산)의 소유주가 타 제도단위에게 자금을 공급하거나 유형 비생산자산을 사용하도록 하고 그 대가로서? 수취하는 소득으로 정의됨
663,재정부담률,국민총생산(GNP) 혹은 국내총생산(GDP)에서 차지하는 재정지출규모를 나타내는 지표이다. 재정부담률 = 재정지출액 / 국민(내)총생산액 × 100 
664,재정수지,"일반회계, 특별회계, 공공기금간의 전출금 및 전입금등 회계간의 내부거래와 국채발행, 차입, 채무상환등 수지차 보전을 위한 보전거래, 즉 재정상의 채권·채무행위액을 세입과 세출에서 각각 제외한 순계개념의 세입과 세출(순융자 포함)의 차를 의미한다."
665,재정정책,"정부지출과 조세를 정책수단으로 사용하는 정부의 제반 정책을 일컬어 재정정책이라고 한다. 재정정책의 목표는 각 국가의 상황 및 경제발전 단계 등에 따라 다를 수 있지만 일반적으로는 완전고용, 물가안정, 국제수지 균형, 경제성장, 소득재분배 등을 주목표로 한다.

그러나 좁은 의미에서는 정부지출과 조세수입의 양과 구조를 의도적으로 변화시켜 총수요를 조절함으로써 경제안정을 도모하려는 확장적 혹은 긴축적 재정활동만을 재정정책이라고 하기도 한다.

그리고 정부가 정부지출이나 조세를 의도적으로 조정함으로써 국민소득 변화 및 경제안정을 추구하는 것을 재량적 재정정책(discretionary fiscal policy)이라 한다"
666,재정투융자,"일반적인 개념에 따른 재정투융자는 재정지출 중 자본적 지출과 금융적 투융자지출을 의미하는데 자본적 지출이라 함은 건물, 설비, 기계, 도로, 교량 등 정부자산을 증대시키는 일체의 지출을 말하며 금융적 투융자지출은 정부가 재정자금 및 각종 기금 등의 유상자금을 민간사업이나 정부정책사업에 출자 또는 융자의 형태로 임차관계를 맺는 지출, 즉 기간산업의 자금부족을 보완하거나 민간자금에 의하여 행할 수 없는 부문에 자금을 공급하는 것을 일컫는다. 통상 자본적 지출은 일반회계 및 각종 특별회계, 기금 등에 포함되어 지출되고 있으며 96년까지 운영된 재정투융자특별회계에서의 재정투융자는 자본적 지출을 제외한 정부출자·출연 및 재정융자 등 금융적 투융자 활동만을 포함하는 개념이다. 97년부터 종전의 재정투융자특별회계를 재정융자특별회계로 개편하여 재정투융자특별회계 출자계정에서 수행하던 정부출자·출연을 일반회계에서 지출토록 하고 재정융자특별회계는 재정융자와 차관관리만을 담당한다."
667,재해강도율,"근로시간 합계 1,000시간당 재해로 인한 근로손실일수를 말하며, 재해로 인한 피해정도를 나타내는 것으로 근로손실일수를 연근로시간수로 나누어 1,000분비로 산출한 것이다"
668,재해도수율,"연간근로시간수(월평균 근로시간×12×근로자수)에서 재해건수가 차지하는 비율을 백만분비로 나타낸 것으로, 100만 근로시간당 재해발생건수를 말하며 재해가 일어나는 빈도를 나타낸다."
669,재해발생률,"통계의 대상이 된 기간 중에 발생한 총 재해건수를 동일기간 중 위험에 노출된 평균 근로자수로 나누어 1,000을 곱하여 계산한다. 재해발생률 = 총재해건수 / 평균근로자수 × 1,000 "
670,재화,"겨울바람이 불기 시작하면 손이 시려서 따듯한 장갑을 찾게 된다. 책과 연필, 공책을 손에 들고 다니려면 불편하니까 가방이 있어야 한다. 이처럼 사람들의 욕구를 충족시켜 주는 물건, 인간 욕망의 대상이 되는 물질적 수단을 재화라고 한다.

재화에는 소비재와 생산재가 있다.
소비재란 사람들이 욕망을 채우기 위해 일상생활에서 직접 소비하는 재화를 가리키는데 소비재는 사람들의 생활에 곧 사용되도록 완성된 것이며 사람들의 욕망을 충족시킨다는 뜻에서 직접재라고도 한다. 생산재란 소비재를 생산하기 위해 사용되는 재화이며 생산자가 구입, 이용하므로 생산자재라고도 한다.
그러나 같은 재화라도 그 용도에 따라서 소비재도 생산재도 되는 것이 있다. 가정에서 사용 하는 전기는 소비재이지만 공장에서 사용하는 전기는 생산재이다."
671,저축,저축은 가처분소득중 최종소비용 재화 및 서비스에 사용되지 않은 부분을 나타내며 가처분소득과 최종소비지출의 크기에 따라 (+)일 수도 있고 (-)가 될 수도 있음
672,저축률과 투자율,"국민계정에 등장하는 개념으로 한 나라 국민이 소비나 저축으로 자유롭게 사용할 수 있는  ‘국민총처분가능소득’ 가운데 저축의 비중을 저축률이라고 하며, 투자가 차지하는 비중은 투자율이라고 한다. 
저축은 국내투자를 충당하고도 남은 경우 외국에 빌려주게 되며 반대로 모자라면 투자자금을 외국에서 조달해 와야 한다. 이때 외국에 빌려준 자금은 우리나라 저축이 외국에 투자되었다는 의미에서 국외투자라고 부른다. 따라서 국내총투자와 국외투자를 합한 총투자는 총저축과 항상 일치하게 된다.
"
673,저축성예금,예금납입 및 인출방법에 대해 특정 조건이 있는 기한부 예금으로 주로 장기저축이나 이자수입을 목적으로 하는 예금을 말한다. 예금주의 명의 표시에 따라 기명식 정기예금·무기명식 정기예금으로 분리하기도 한다.
674,전기오류수정이익(손실) ,"전기 또는 그 이전기간에 발생한 오류의 수정인 경우 손익계산서의 영업외비용(전기오류수정이익(손실))으로 처리하나 중대한 오류의 수정인 경우에는 전기이월이익잉여금에 반영하게 된다. 전기오류수정손익의 대상은 계산상의 실수, 기업회계기준의 잘못된 적용, 사실판단의 잘못, 부정, 과실 또는 사실의 누락 등이며 이는 추가적인 정보를 입수함에 따라 기존의 추정치를 수정하는 회계추정의 변경과는 구분된다."
675,전기이월이익잉여금 ,"전기로부터 당기로 이월된 이익잉여금을 말한다. 즉, 전기의 차기이월이익잉여금과 당기의 전기이월이익잉여금이 일치한다."
676,전력수급,"· 공급능력 : 총발전 설비능력에서 장비의 고장, 노후화, 보수 등으로 인한 능력 감소분을                 제외시킨 능력
  · 최대전력 : 연중부하가 최대일때의 시간당 전력
  · 평균전력 : 총사용전력 ÷ 연시간· 부 하 율 : (평균전력 ÷ 최대전력) × 100
  · 이 용 률 : (평균전력 ÷ 발전설비) × 100
  · 예비전력 : 공급능력 - 최대전력
  · 공급예비율 : (공급능력 - 최대전력) ÷ 최대전력 × 100"
677,전문가,"주된 업무가 자연과학, 생명과학 및 사회과학 분야에서 높은 수준의 전문적 지식과 경험을 기초로 과학적 개념과 이론을 응용하여 해당 분야를 연구, 개발 및 개선하며 고도의 전문지식을 이용하여 의료진료 활동과 각급 학교 학생을 지도하고 예술적인 창작활동을 수행하는 자와, 또한 행정·경영 등에 관련된 의사결정 업무를 수행하는 자를 말한다"
678,전세평가액,전세로 임차한 가구를 동일 규모의 인접 임차가구에 대한 월세지출액을 참작하여 평가한 귀속 임차료를 말한다
679,전자상거래,전자상거래는 인터넷이나 PC통신을 이용해 상품 등을 사고파는 행위를 말하는 것으로 넓은 의미로는 컴퓨터 통신망을 통해 이루어지는 상품 및 서비스 구매나 발주 광고 활동 등이 모두 포함된다. 이와 같은 거래의 가장 큰 장점은 시간과 공간의 제약이 없다는 점이기 때문에 직접 매장까지 나가는 번거로움을 덜 수 있고 거래대금은 주로 신용카드로 결제된다. 또 유통 비용이나 건물 임차료 등의 비용이 전혀 없으며 전세계 모든 인터넷 가입자가 잠재고객이란 점에서 첨단황금 어장에 비유되기도 하고 CALS(Commerce at light speed; 광속거래)에 포함시키기도 한다.
680,접대비 ,"접대비, 교제비, 기밀비, 사례금, 기타 명목으로 사용되거나 이와 유사한 성질의 비용으로서 법인의 업무와 관련하여 금전이외의 재화나 서비스를 제공하는 데 지출한 금액이며 금전을 제공한 경우는 기부금으로 처리하게 된다."
681,정도,"측정에서 일어나는 오차와 관련하여 엄격한 의미에서는 정도와 정확도(Accuracy)는 구분되는 개념이다. 정확도라 함은 관측값과 관측대상과의 근접정도로서 일반적으로 확률오차(Random error)와 편의에 기인한 계통오차(Systematic error)의 합을 나타내는 것이고, 정도는 확률오차에만 관련된 것으로 반복측정에서 얼마나 재현성이 있는가, 즉 얻어진 각 측정값간의 산포정도를 나타낸다. 일반적으로 어떤 추정량(Estimator)의 정도는 그것이 기초한 표본수의 평방근에 반비례한다."
682,정보의 비대칭성,"시장에서 거래쌍방 중 한쪽만이 특정 정보를 가지고 있는 현상을 의미한다. 이러한 정보의 비대칭성은 역선택(adverse selection) 및 도덕적 해이(moral hazard)를 발생시킨다.

예컨대 노동시장에서 회사측이 회사의 현재 및 미래 재정 상태에 대한 정보를 노조측 보다 풍부히 가지고 있어서 임금 협상에서 우월한 협상력을 가지게 되는 현상이나 중고차 시장에서 상등품 중고차는 사라지고 하등급 중고차만이 거래되는 현상은 정보의 비대칭성 때문에 발생하는 현상이다"
683,정보컨텐트산업,"일반 대중을 대상으로 정보컨텐츠의 생산 및 배급을 주된 활동의 일부로 하는 산업을 말하며, 정보컨텐츠란 전자매체(CD, 디스켓, 자기테이프, 마이크로칩, 컴퓨터 등)에 저장되어 전송되는 정보내용을 말한다."
684,정보통신산업,"제조업부문에서 정보의 전달과 표시, 정보처리와 물리적 현상의 기록·측정·조사, 물리적 공정의 제어를 위해 전자적 처리수단이 사용되는 산업과 서비스업부문에서 전자적 수단에 의하여 정보를 처리, 전달, 시현하는 산업을 말한다"
685,정보화 사회,"최근 정보통신기술의 급속한 발달로 인한 충격은 정보통신관련 산업에 국한되지 않고 경제·사회의 여러 부문으로 확산되고 있다. 이는 정보통신기술이 지식기반경제의 성장과 정보화 사회를 촉진하는 기폭제이기 때문이다. 정보화 사회는 정보화 경제와 정보화 경제의 사회적 영향으로 이루어지며, 정보화 경제는 정보통신산업(Information and Communication Technologies), 정보컨텐츠산업, 정보통신 상품과 정보의 이용으로 구성된다."
686,정부실패,"시장실패를 교정하기 위한 정부의 개입이 자원배분의 효율성을 높이기보다 오히려 해치는 경우가 있는데 이를 시장실패에 비유하여 정부실패라고 한다.

규제자의 불완전한 지식?정보, 규제수단의 불완전성, 규제자의 경직성 등의 이유로 정부실패가 일어난다. 또 정부는 대부분의 영역에서 독점적인 지위를 갖고 있어 민간 기업처럼 경쟁을 해야 할 필요가 없으며 성과에 따라 보상을 받는 유인제도도 부족하기 때문에 정부실패가 발생하기도 한다.

예컨대 최근 많은 국가들에서 정부는 국민들의 안정된 노후생활을 보장하기 위해 사회보장제도를 실시하고 있다. 그러나 정부가 사회보장제도를 잘못 운영할 경우 근로능력이 있음에도 고의로 일을 하지 않는 계층이 생기고 사회보장기금이 방만하게 운영되는 등 심각한 비효율이 초래될 수 있다. 이런 경우 정부의 시장개입이 오히려 자원배분의 효율성을 악화시키는 정부실패를 가져오게 된다.

정부실패를 방지하기 위해서는 정부정책의 투명성 강화, 정부부문에의 유인제도 도입, 입법부?감사원?시민단체 등에 의한 감시활동 강화 등의 조치가 필요하다"
687,정확도,"일반적인 통계학적 의미로 정확도는 계산된 값이나 추정값이 참값(True value)에 얼마나 가까이 있는가 하는 측도를 말한다. 구체적으로 (i) 추정량에서 정확도는 불편성을 의미하고, (ii)표준오차의 역수로 나타내질 때는 정도(Precision)를 나타낸다"
688,제2차 소득분배계정,제2차 소득분배계정은 소득분배의 두번째 단계를 나타내는 계정으로서 각 제도단위 또는 제도부문이 지급 또는 수취하는 모든 경상이전(사회적 현물이전 제외)을 기록함으로써 제1차 분배계정의 본원소득 잔액에서 가처분소득이 산출되는 과정을 보여줌
689,제도부문,"제도부문이란 개별 제도단위(institutional unit)의 집합으로써, 생산자의 유형 및 경제활동과 기능을 기준으로 분류된다. 1993 SNA에서는 한 경제를 구성하는 제도부문을  비금융법인, 금융법인, 일반정부, 가계에 봉사하는 비영리단체, 가계 등 상호배타적인 다섯개의 제도부문으로 분류한다."
690,제조업,"물질 또는 구성요소에 물리적, 화학적 작용을 가하여 새로운 제품으로 전환시키는 산업활동을 말한다. 따라서 단순히 상품을 선별·분리·포장·재포장하는 경우 등과 같이 그 상품의 본질적 성질을 변화시키지 않는 처리활동은 제조활동으로 보지 않는다. 이러한 제조활동은 공장이나 가내에서 동력기계 및 수공으로 이루어질 수 있으며 생산된 제품은 도매나 소매형태로 판매될 수 있다"
691,제조업가동률지수,제조업 생산설비의 가동상태 추이를 나타내는 지수. 가동률지수는 설비가동의 절대수준을 나타내는 것이 아니라 기준년도의 가동률을 100으로 하였을 때 비교시의 가동상태가 어느 수준인가를 나타낸다
692,제조업생산능력지수,"제조업체가 주어진 조건 하에서 인력, 설비, 조업시간 등이 정상적으로 생산에 투입되는 상황에서 달성할 수 있는 최대 생산가능량을 지수로 나타낸 것이다."
693,제조원가명세서 ,"제조원가명세서는 재무제표의 부속명세서의 하나로서 제품 제조에 소비된 원가의 계산명세를 나타내며 당기제품제조원가는 당기에 발생한 재료비, 노무비, 경비 등의 당기총제조비용에서 기초재공품원가를 더하고 기말재공품원가와 타계정 대체액을 차감하여 계상하게 된다."
694,제표,"집계는 조사표에 기입된 개별적인 신고를 통계숫자의 형태로 편성, 정리한 것이다. 그러나 조사단위는 각각 통계집단의 각 단위로 볼 때는 어떤 점에서는 같으나 기타의 점에서는 무한한 이질성을 갖고 있다. 따라서 통계집단의 크기뿐만 아니라, 그 구조를 볼 때는 집계는 각 단위를 공통의 표식을 갖는 집단으로 정리한다는 작업을 반드시 수반한다. 일반적으로 분류와 집계라고 하는 단계를 거쳐서 최후로 목적하는 결과표가 작성되는 것으로, 이와 같은 3단계를 총합하여 제표라고 한다."
