번호,용어,설명
165,기술혁신,"생산이나 소비가 매년 같은 규모로 반복되고 경제체계의 규모가 변치않는 것을 정태라고 한다. 이에 비하여 현실에 있어서는 경제규모가 매년 변동되며 이러한 동태의 상태에 있어서 무엇이 경제규모를 변동시키는가에 대하여는 많은 이론이 전개되었다. 이 중에서 특히 슘페터(Schumpeter, J.A)는 기업가의 활동을 중요시하고 경제발전은 기업의 혁신(이노베이션, 혁신, 신결합 또는 신기축이라고도 함)에 의존된다고 하였다. 그에 의하면 혁신이란 ①신상품의 생산, ②신생산방법의 도입, ③신시장의 개척, ④신자원의 획득 및 이용, ⑤신조직의 달성 등에 의하여 생산요소를 신결합하는 것을 가르키며, 기업이윤이 창조되고 정태적 균형을 파괴하고 동태적 경제발전을 행하는 것은 이러한 혁신에 의존된다고 하였다."
166,기업경기실사지수(BSI),기업가들을 대상으로 기업경기 현황과 전망을 설문조사하고 그 결과를 지수화한 통계로 당월말에 당월 통계가 발표되므로 기업가들이 체감하는 경기동향 및 전망의 신속한 파악이 가능 
167,기업경상이익률 ,자금원천에 관계없이 기업에 투하된 총자본이 얼마나 효율적으로 운용되었는가를 나타내는 지표로서 경상이익에서 차입금에 대한 이자비용을 차감하기 전의 금액을 총자본과 대비한 것이다. 따라서 기업가의 경영능력을 측정하는 지표로 이용되고 있다
168,기업경영분석의 1인당 부가가치 증가율,「기업경영분석」의 1인당 부가가치증가율은 종업원 한 사람이 산출한 부가가치액의 전년대비 증가율로 측정되는 대표적인 노동생산성 지표이다.
169,기업단위,"기업단위란 재화 및 서비스를 생산하는 법적 또는 제도적 단위의 최소결합체로서 자원배분에 관한 의사결정에서 자율성을 갖고 있으며, 수입, 지출 및 자금관리에 관한 손익계산서 및 대차대조표와 기타 기록을 유지관리하는 단위이다. 이는 주식회사, 협동조합, 협회, 조합 등의 법인과 법인계열 등을 포괄하며, 정부조직도 하나의 기업으로 간주할 수 있을 것이다. 이러한 기업은 하나 이상의 사업체로 구성될 수 있다는 점에서 사업체와 구분된다. 따라서 각 산업의 자금원천 및 용도, 생산자금에 관한 자료 등을 파악하고 상호 비교하는데 필요한 재무관련 통계작성에 가장 유용한 단위이다. 그러나 기업은 각기 다른 분야의 경제활동에 종사하는 여러개의 공장, 광산, 상점 등을 소유 또는 관리하는 경우가 많으므로 그러한 기업 전체를 단일항목에 분류하여 분석하기에는 대단히 곤란하며 또한 산업분류의 적용단위로서 기업단위를 사용한다면 산업이 다른 각종 경제활동이 단일산업 항목에 분류되는 수가 있을 것이므로 산업분류의 적용단위로서는 부적합하다. 또한, 경제 또는 산업의 집중정도를 측정하거나 기업간의 국내외적 연합을 설명할 수 있는 통계자료를 생산하고, 사업소유권의 집중 또는 분산상태의 연구를 위한 분석단위로 기업집단을 사용할 수 있다."
170,기업순이익률 ,당기순이익과 이자비용의 합계액을 총자본과 대비한 비율로서 기업에 투하된 총자본의 종합적인 최종성과를 나타내는 비율이다
171,기업심리지수(CBSI),"기업경기실사지수(BSI)중 주요지수(제조업 5개, 비제조업 4개)를 표준화하여 합성한 지수로서 과거 장기평균을 기준값 100으로 하여 100보다 크면 기업들의 심리가 장기평균보다 낙관적임을, 100보다 작으면 비관적임을 의미
"
172,기준금리,"한국은행이 금융기관과 환매조건부증권(RP) 매매, 자금조정 예금 및 대출 등의 거래를 할 때 기준이 되는 정책금리"
173,기준년가격,"시간의 경과에 따른 재화 및 서비스 플로우의 가액 변동은 두 가지 구성요소로 세분화할 수 있는데 하나는 재화 및 서비스의 가격변동이며 다른 하나는 물량변동, 즉 기준년가격 표시의 물량변동임. 이에 따라 기준년가격 표시에 의한 국민총생산은 기준년 이후의 물가변동분을 제거한 수치임"
174,기준시,"지수를 작성할 때 기준이 되는 시기를 말한다. 이것은 보통 특정연도로 표시된다. 그러나 경우에 따라서는 수 개 연도의 평균으로 될 수도 있고, 1개월, 1주일이 될 수도 있다. 우리 나라의 물가지수나 산업생산지수 작성에 있어서의 기준시는 서력기원의 5의 배수로 되는 해로하여 매 5년마다 기준시를 바꾸는 것을 관례로 하고 있다."
175,기초가격,‘기초가격’은 생산된 재화 또는 서비스의 한 단위당 생산자가 구매자로부터 수취하는 금액에서 그 생산물단위의 생산 또는 판매에 따라 발생하는 조세(=생산물세)를 차감하고 그 생산물단위의 보조금(=생산물 보조금)을 더한 것임.? 이 가격에는 생산자가 별도로 청구하는 운송료가 제외됨
176,기초재공품원가 ,"재공품은 제품 또는 반제품의 제조를 위한 생산과정에 있는 것으로, 기초재공품원가는 전기에서 이월된 재공품 잔액을 말한다."
177,기타 구축물,"기타 구축물이란 건물을 제외한 구축물으로서 도로, 하수도, 대지정리 및 준비비용을 포함함.? 주거용 또는 비주거용 건물이 아닌 역사적 기념물과 지하자산 채굴을 위한 통로, 터널, 및 기타 구축물 등도 포함함(단, 홍수 통제를 위한 댐이나 제방 등 토지의 개량을 위한 구축물은 토지가액에 포함함)"
178,기타경비 ,"주요 경비 항목 외의 소모품비, 여비교통비, 통신비, 특허권사용료 및 잡비 등의 비용의 합계액이다."
179,기타고정부채,지급기한이 1년 이상인 고정부채중 위에서 열거한 항목 이외의 장기성 매입채무 및 기타의 고정부채 등을 말한다
180,기타단기차입금,"기타단기차입금은 금융기관 이외의 자로부터 차입한 단기차입금으로서 관계회사 단기차입금, 주주·임원·종업원 단기차입금 등이 포함된다"
181,기타당좌자산 ,"당좌자산을 합계하여 기재하며 여기에는 단기대여금, 미수수익, 선급금, 선급비용, 관계회사 및 주주·임원·종업원에 대한 단기채권, 선급법인세 등이 포함된다. 단기대여금은 회수기간이 1년 이내에 도래하는 대여금과 어음상의 채권을 말하고 미수수익은 당기에 속하는 수익중 미수액으로 한다."
182,기타법정적립금 ,"기업합리화적립금, 재무구조개선적립금 등 상법 이외의 법령의 규정에 의하여 의무적으로 적립하여야 할 적립금을 말한다."
183,기타영업외비용 ,"기타영업외비용은 주요 영업외비용 외에 회사의 일상적인 영업활동과 관련이 없으며, 예외적으로 드물게 발생하는 비용을 정산해 기록한다. 재고자산평가손실, 기부금, 잡손실 등이 있다."
184,기타영업외수익 ,"기타영업외수익은 주요 영업외수익 외에 회사의 일상적인 영업활동과 관련이 없으며, 예외적으로 드물게 발생하는 수익을 정산해 기록한다. 수입임대료, 사채상환이익, 지분법이익, 잡이익 등이 있다."
185,기타유동부채,"대차대조표일로부터 1년 이내에 지급·상환되는 채무로 선수금, 예수금, 미지급비용, 미지급법인세, 선수수익, 단기부채성충당금 및 기타의 유동부채가 포함된다."
186,기타유형자산,"토지, 건물, 구축물 등을 제외한 기계장치, 비품, 차량운반구 등의 유형고정자산을 의미한다."
187,기타이익잉여금처분액 ,"이익잉여금처분액 중에서 위에 열거한 항목에 속하지 아니하는 처분액으로서, 이에는 주식할인발행차금상각, 배당건설이자상각, 자기주식처분손실잔액, 상환주식상환액 등을 포함한다."
188,기타장기차입금,"기타장기차입금은 회사채 및 장기금융기관차입금을 제외한 차입금중 1년 이후에 상환기일이 도래하는 모든 차입금을 말한다. 이 항목에는 관계회사장기차입금, 주주·임원·종업원 장기차입금 등이 포함된다."
189,기타재고자산 ,"기타재고자산은 위의 항목 이외의 재고자산을 합계하여 기재하며 재공품, 저장품 등이 포함된다. 재공품은 제품 또는 반제품의 제조를 위하여 생산과정에 있는 것을 말하고 저장품은 소모품, 소모성 공구기구비품, 수선용 부분품 및 기타 저장품을 말한다."
190,기타처분전이익잉여금,"처분전이익잉여금 중에서 회계변경의 누적효과, 전기오류수정손익, 지분법적용회사의 잉여금 변동 및 당기순이익 등에 속하지 아니하는 이익잉여금으로서 자사주이익소각, 특별수선충당금환입액 등을 포함한다."
191,기타투자,"직접투자, 증권투자에 포함되지 않는 외국과의 여타 금융거래로서 대출 및 차입, 무역신용, 현금 및 예금, 기타자산이나 부채등으로 구분"
192,기타판매비와 관리비 ,"판매비와 관리비의 주요 항목인 인건비, 복리후생비, 광고선전비, 지급수수료, 판매수수료  등 이외에 기타 여비, 교통비, 수선비, 견본비 등을 말한다."
193,기하평균(Geometric average,"여러 개의 수를 연속으로 곱하여 그 개수의 거듭제곱근으로 구한 수. 흔히 인구성장률이나 경제성장률을 구할 때 적용된다. 기하평균은 집단의 변량에 부(負)의 값이 나타나지 않을 경우에 한해서 이용되며, 다소 계산이 복잡하나 변량의 극단적인 값의 영향을 받지 않는다"
194,기혼부인당 평균출생아수,"기혼부인 1인당 평균출생아수를 나타내는 것으로, 기혼부인 특성별(교육정도, 직업, 산업별 등)로 차별출산력을 분석하는데 주로 이용되는 지표이다."
195,기회비용,"인간의 욕구는 무한한 데 반해 인간에게 필요한 자원(돈, 시간 등)은 한정되어 있기 때문에 사람에게 유용한 모든 것은 늘 항상 부족하기 마련이다. 이처럼 인간의 욕구에 비해 자원이 부족한 현상을 희소성이라고 한다.

이처럼 희소한 자원을 가지고 인간의 모든 욕구를 충족시킬 수 없기 때문에 인간은 누구든지 부족한 자원을 어느 곳에 우선적으로 활용할 것인가를 결정하는 선택을 해야 한다. 즉 다양한 욕구의 대상들 가운데서 하나를 고를 수 밖에 없다는 뜻이다. 이러한 선택은 필연적으로 선택된 욕구와 선택되지 못한(즉, 선택을 포기한) 욕구들로 나뉘게 된다. 이 때 포기해 버린 선택의 욕구들로 부터 예상되는 유ㆍ무형의 이익중 최선의 이익을 기회비용이라고 한다. 따라서 자원의 희소성이 존재하는 한 기회비용은 반드시 발생하게 되어 있고 이는 경제문제를 발생시키는 근본요인이 된다.

예를 들면 홍길동씨가 주어진 1시간 동안에 책을 읽을 수도 있고, 운동을 할 수도 있고, PC게임을 할 수도 있는 상황에서 책을 읽는 선택을 한 경우를 생각해보자. 이 때 홍길동씨가 포기해 버린 대안은 운동을 하는 것과 PC게임을 즐기는 것이다. 그런데 운동을 하는 것은 PC게임을 즐기는 것보다 더 많은 유ㆍ무형의 이익(예컨대 신체가 튼튼해지거나 스트레스가 해소되는 것 등)을 홍길동씨에게 줄 수 있어서 포기한 대안들 가운데 최선의 대안이었다고 가정을 해보자. 그러면 이 경우 홍길동씨가 책을 읽는 선택을 함으로써 지불한 기회비용은 1시간 동안 운동을 함에 따라 발생할 수 있는 유ㆍ무형의 이익(예컨대 신체가 튼튼해지거나 스트레스가 해소되는 것 등)이 된다"
196,긴축정책,"경제 정책당국이 경기조절을 위해 사용할 수 있는 대표적인 두 가지 정책은 재정정책과 통화정책이 있다. 재정정책은 정부가 나라살림에 사용하는 씀씀이나 거둬들이는 세금을 조절함으로써 경기를 안정화 시키려는 것이고 통화정책은 중앙은행이 시중에 유통되는 돈의 양이나 금리 등을 조절함으로써 경기를 안정화 시키려는 정책을 말한다.

그런데 경기가 과열되어 물가급등에 대한 염려가 커지면 정부는 씀씀이를 줄이거나 국민들로부터 더 많은 세금을 걷어 국민들이 지출에 사용할 수 있는 소득을 줄이려고 한다. 한편 중앙은행의 경우에는 물가급등에 대한 염려가 커지면 시중에 유통되는 돈의 양을 줄이거나 금리를 인상함으로써 국민들이 지출에 사용할 수 있는 소득을 줄이려고 한다. 이렇게 되면 두 경우 모두 소득이 줄어든 국민들이 재화 및 서비스에 대한 소비를 줄이게 되어 물가가 하락하게 된다. 이처럼 경기과열 우려가 있는 경우에 재정 또는 통화 정책이 국민의 소득을 감소시켜 재화 및 서비스에 대한 수요를 위축시키는 방향으로 전개되면 이를 긴축정책이라고 표현한다.

한편 동일한 긴축정책이라 하더라도 재정정책과 통화정책이 경제에 미치는 영향은 서로 다른 것으로 알려져 있다. 긴축적 재정정책은 금리하락을 초래하여 기업의 투자를 늘릴 가능성이 있는 반면에 긴축적 통화정책은 금리인상을 초래하여 기업의 투자를 위축시킬 가능성이 있다. 그러나 두 가지 긴축정책 모두 궁극적으로는 국민들의 재화 및 서비스에 대한 수요를 위축시켜 물가를 안정시킨다는 점에서 공통점이 있다."
197,내생부문,내생부문이란 외생부문의 수치가 모형밖에서 주어지면 이에 따라 수동적으로 모형 내에서 그 값이 결정되는 부분이란 의미로 산업연관표 작성과정에서 가장 어려운 부분이며 작성된 표의 분석이나 이용에 있어 가장 중요한 부분
198,내수기업,"수출 비중에 따라 수출기업과 내수기업으로 구분할 수 있다. 수출기업은 매출액중 수출비중이 50% 이상인 기업을 뜻하고, 내수기업은 총매출액 중 수출의 비중이 50% 미만인 업체를 말한다."
199,내용년수,"고정자산이 경제적으로 사용될 수 있는 년수, 즉 보통의 상태 및 조건하에서 통상의 수리를 전제로 하여 그 자산이 폐물로 되어 파기할 때까지의 이용기간 또는 사용예정기간을 말한다."
200,네트웍,"정보기술에서 말하는 네트웍은 통신선로에 의해 서로 연결되어 있는 일련의 노드 또는 연결점들을 의미한다. 네트웍은 다른 네트웍과 연결될 수 있고, 서브 네트웍을 포함할 수 있다. 대형 전화망이나 인터넷과 같은 기간망을 쓰는 네트웍들은 다른 회사와 시설이나 교환망을 공유함으로써 더 커다란 네트웍을 이룬다. 네트웍의 가장 보편적인 형상이나 구성에는 버스형, 성형, 고리형 등이 있으며, 네트웍의 공간적인 거리에 따라 LAN (local area network), MAN (metropolitan area network) 그리고 WAN (wide area network)으로 나뉘어진다. 보통 주어진 네트웍은 다음의 내용에 따라 그 특성이 결정된다.

①데이터 전달 기술의 형식에 따라,
(예) TCP/IP망, SNA망 등
②음성을 전송하는지 데이터를 전송하는지, 아니면 그 둘다를 전송하는지에 따라,
③누가 그 네트웍을 사용하는지에 따라,
(예) 공공망이나 사설망 등
④통상적인 접속방법에 따라,
(예) 다이얼업망, 교환망, 전용망, 가상접속망 등
⑤물리적인 링크의 형식에 따라,
(예) 광섬유, 동축케이블, 구리선"
201,노동계수,노동계수는 일정기간 생산활동에 투입된 노동량을 총산출액으로 나눈 계수로서 1단위 생산에 직접 필요한 노동량을 의미하므로 노동생산성과는 역수관계에 있다. 노동계수는 포함하는 노동량의 범위에 따라 고용계수와 취업자계수로 나눌 수 있는데 고용계수는 고용된 유급노동자를 의미하는 피용자만을 포함한 개념이고 취업계수는 피용자에게 자영업자와 무급가족종사자를 포함한 개념이다.
202,노동력,"노동력이란 다음 두 가지 의미를 갖고 있다. 첫째로, 거시적 개념으로 경제활동인구(또는 노동을 담당하고 있는 인구)의 수이다. 둘째로, 미시적 개념으로 상품으로서의 노동력을 뜻한다"
203,노동생산성,"기업이 생산활동을 처음 시작하기 위해서는 일반적으로 노동, 자본, 토지 등의 생산요소가 필요하다. 그런데 일단 생산이 시작된 이후에 시설수준의 변화없이 기업이 생산량을 추가적으로 늘리기 위해서 필요한 생산요소는 노동과 자본, 이 2가지로 한정된다. 그런데 이 과정에서 특히 생산을 위해 투입되는 노동의 양과 생산량의 관계를 수치적으로 측정하기 위한 지표가 노동생산성이다.

노동생산성은 기업이 생산한 재화 및 서비스의 생산량을 투입된 노동의 양으로 나누어 준 것이다. 즉, 노동 1단위당 생산량(식 1)을 의미한다. 일반적으로 생산에 투입된 노동의 양은 일정 기간 동안의 근로자수와 근로자 1인당 평균근로시간을 곱하여 측정한다. 한편 생산량은 생산된 재화나 서비스의 수량을 측정하는 물적기준에 의해서 측정하거나 또는 생산된 재화나 서비스의 부가가치를 측정하는 방법에 의해 측정될 수 있다.

예를 들어 TV 공장에서 하루에 100명의 근로자가 1인당 평균 10시간을 일해서 생산한 재화의 개수가 총 10,000개이고 부가가치로는 100,000,000원이라고 하자. 이 경우 노동투입량은 1,000(=100×10)이고, 물적기준의 생산량은 10,000개이며 부가가치기준의 생산량은 100,000,000원으로 측정된다. 따라서 물적기준으로 본 이 공장의 노동생산성은 노동 1단위당 10개이고<식2 참고> 부가가치기준의 생산성은 노동 1단위당 100,000원이다.<식3 참고>

그런데 노동생산성은 소득분배 문제와 관련하여 중요한 의미를 갖는다. 생산활동에 종사한 근로자가 어느 정도의 임금을 받는 것이 경제적으로 가장 합리적인가에 대한 기준을 제시해 주기 때문이다. 예컨대 근로자 본인이 생산에 기여한 정도인 노동생산성을 정확히 측정할 수 있고 이에 상응하는 임금을 준다면 기업가와 근로자 모두 이에 대해 큰 무리없이 수긍할 가능성이 높다.

참고로 한국생산성본부의 자료에 따르면 우리나라의 5인 이상 사업자를 기준으로 한 광공업의 노동생산성(물적기준)은 2000～05년중에 38.9% 증가한 것으로 나타났다."
204,노동유발계수,노동유발계수는 노동계수에 최종수요 한단위당 직·간접 생산유발효과를 나타내는 생산유발계수(역행렬계수)를 곱하여 구하며 어느 한 부문의 열 합계는 한 산업의 최종수요가 1단위 증가하는 경우 각 산업에서 유발되는 노동증가율을 이름
205,노동장비율 ,생산과정에서 종업원 한 사람이 어느 정도의 노동장비를 이용하고 있는가를 나타내는 지표이다.
206,노령화지수,유년층 인구에 대한 노령층 인구의 비율로 이 지수가 증가할 때 이러한 현상을 노령화라고 하며 인구의 연소화에 대한 상대적 개념이다
207,노무비 ,"제품의 제조에 직·간접적으로 종사하는 공장종업원에 대하여 지급하는 임금, 상여, 잡급과 퇴직급여 등을 말한다"
208,노임단가지수,단위생산물당 임금을 나타내는 자료로서 일반적으로 노임단가지수는 단위노동비용보다 작거나 같은데 이는 임금이 노동비용을 구성하는 일부분이기 때문이다
209,농가,"생계 또는 영리를 목적으로 다음 항목중 한가지 이상에 해당하는 농업을 경영하거나 농업에 종사하는 가구를 말한다.
①10a(약 300평) 이상의 경지를 직접 경작하는 가구
②연간 농축산물의 판매액이 50만원 이상으로 농업을 계속하고 있는 가구
③연간 농축산물의 판매액이 50만원 미만이라도 조사기준시점 현재 50만원 이상의 가축을 사육하는 가구"
210,농가경제잉여,가처분 농가소득에서 가계비 및 분가지출을 차감한 잔액으로서 연간 농업생산활동 및 농외 소득활동 결과로부터 얻은 잉여를 말하며 농가경제의 흑자 또는 적자를 판단하는 지표로 활용된다
211,농가부채,"농가가 타인에 대하여 지불해야 할 각종의 채무 및 미불입금 등의 현금, 현물을 말하며, 차입금, 외상매입금, 미리 타고 불입하지 않은 곗돈 등이 포함된다"
212,농가소득,"세대주 또는 동거가족이 가계유지를 목적으로 직접 농작물을 재배하거나 가축을 사육하는 가구의 농업소득과 부업으로 영위하는 축산ㆍ양어ㆍ고공품제조ㆍ민박ㆍ음식물판매ㆍ특산물제조ㆍ전통차제조 및 그 밖의 이와 유사한 활동에서 발생한 농외소득, 이전수입을 합산한 총액이다."
213,농가인구,"조사기준일 현재 농가에서 3개월 이상 살았거나 3개월은 살지 않았어도 조사기준일을 전후하여 3개월이상 같이 살게 될 가구원을 말하며 혈연관계가 없는 가정부, 유모도 포함된다. 단, 하숙생과 농사이외의 일로 고용된 사람은 제외한다."
214,농가자산,농업을 경영하는데 있어 편익을 제공하는 일체의 경제적 자원을 말하며 경영과 가계가 분리되어 있지 않은 농가의 특성상 현금 및 시설물 등은 농업뿐만 아니라 가계 겸용으로도 사용되지만 이를 별도로 구분하지 않는다
215,농가판매 및 구입가격지수,농가판매 및 구입가격지수는 농가가 생산한 농산물의 판매가격과 농가의 영농 및 소비생활에 필요한 상품 및 서비스의 구입가격을 조사하여 작성하는 것으로 농가교역조건 산출 등을 통한 농촌경제동향분석 및 농업정책수립에 활용된다
216,농경지,"농경지는 조사기준일 현재 경작하고 있는 경지(논, 밭)를 말하며 소유여부를 불문하는데 논과 밭으로 구분된다. 논은 관개설비를 갖추고 담수를 필요로 하는 작물을 재배할 수 있는 농경지로서 토지대장상의 지목과 관계없이 주로 논벼, 미나리, 왕골, 연뿌리 등을 재배하는 농경지를 말한다. 밭은 관개설비를 갖추지 않고 일반작물을 재배할 수 있는 경지와 과수원, 뽕밭, 관상수, 묘포 등 나무를 심은 밭이 포함되며, 나무를 심은 밭은 30평 이상 집단 재배한 것만 조사대상이 되고 산재된 것은 제외한다"
217,농업,"농업은 토지를 이용하여 인간에게 유용한 동식물을 길러 생산물을 얻어내는 활동으로 작물생산업, 축산업, 복합농업, 조경 및 농업관련서비스업 등의 산업활동을 말한다."
218,농업총조사,"농업의 구조에 관한 자료를 얻기 위한 전수조사를 말하며 농업사업체, 경지면적, 농가인구, 농기계, 농작물 등을 조사항목으로 한다. 농가 및 농가인구의 규모와 분포, 농업의 경영구조 및 특성을 파악하여 농업정책의 수립, 평가 및 국가경제 주요지표를 작성하고 농업관련 연구의 모집단 자료를 확보하며 농업부문 국가경쟁력 강화를 위해 시행된다. 현재 통계청 주관하에 5년 주기로 실시하고 있다."
